<?xml version="1.0"?>
<Students xmlns:xsi="http://www.w3.org/2001/XMLSchema-instance" xmlns:xsd="http://www.w3.org/2001/XMLSchema" xsi:schemaLocation="StudentsData students_list.xsd" xmlns="StudentsData">
  <Student>
    <Name>Anna</Name>
    <Surname>Kowalska</Surname>
    <Date_of_birth>1999-09-09</Date_of_birth>
    <Adress_pernam>
      <City>Wrocław</City>
      <Street>Podwale</Street>
    </Adress_pernam>
    <Adress_temp>
      <City>Warszawa</City>
    </Adress_temp>
    <Classes>
      <Class>
        <Name>Algorytmy</Name>
        <Grade>5</Grade>
      </Class>
      <Class>
        <Name>Bazy</Name>
        <Grade>4</Grade>
      </Class>
    </Classes>
  </Student>
  <Student>
    <Name>Bartosz</Name>
    <Surname>Nowak</Surname>
    <Date_of_birth>1999-08-08</Date_of_birth>
    <Adress_pernam>
      <City>Wrocław</City>
      <Street>Borowska</Street>
    </Adress_pernam>
    <Adress_temp>
      <City>Kraków</City>
      <Street>Lotnicza</Street>
    </Adress_temp>
    <Classes>
      <Class>
        <Name>Logika</Name>
        <Grade>5</Grade>
      </Class>
    </Classes>
  </Student>
</Students>